{
  "$schema": "https://json-schema.org/draft/2020-12/schema",
  "title": "ScopePack",
  "type": "object",
  "required": ["scope"],
  "additionalProperties": false,
  "properties": {
    "schema_version": { "type": "string" },
    "scope": {
      "oneOf": [
        { "type": "string" },
        { "type": "object", "additionalProperties": true }
      ]
    },
    "not_found_reason": { "type": "string" },
    "_cache": { "type": "object", "additionalProperties": true },
    "family_status": {
      "type": "object",
      "required": [
        "schema_version",
        "family",
        "source",
        "status",
        "confidence_score",
        "policy_action",
        "reason"
      ],
      "properties": {
        "schema_version": { "type": "string" },
        "family": { "type": "string" },
        "source": { "type": "string", "enum": ["evidence_pack"] },
        "status": { "type": "string", "enum": ["generated", "abstained"] },
        "confidence_score": { "type": "number" },
        "policy_action": {
          "type": "string",
          "enum": ["keep", "regenerate", "abstain"]
        },
        "reason": { "type": "string" }
      }
    }
  }
}
